,listing_id,address,property_type,property_link,price_per_month,featured_property,dates_available,furnishing,description,longitude,latitude,initial_scrape_date,most_recent_scrape_date,Bermondsey,Borough,Elephant & Castle,London Bridge,Queens Road (Peckham),Rotherhithe,South Bermondsey,Surrey Quays,Wapping
27,49886851,"Acanthus Drive, Bermondsey, London SE1",2 bed flat to rent,https://www.zoopla.co.uk/to-rent/details/49886851,"£1,400 pcm",,1st Feb 2019,Furnished or unfurnished,"Property OverviewFolio London is delighted to offer this spacious two bedroom apartment. With an open planned living/dinning area. Beautifully decorated throughout.Located in Zone 2 there are excellent public transport links. This property is close to Bermondsey Station (jubilee) and Borough tube station (northern).5 minute walk to bus stops &amp; 24 hour buses5 minute walk to retail parks, supermarkets and shops10 minute bus ride to Borough Station (northern line), London Bridge (northern &amp; jubilee &amp; rail) &amp; Elephant &amp; Castle (norther &amp; Bakerloo &amp; rail)20 minute walk to Bermondsey Station (jubilee line)There is resident permit parking available. To meet the reference criteria for this property, you will need to earn a minimum household income of £42,000 p.A.  We are trusted landlords that do not charge fees. At Folio we are passionate about finding you a home that you will love. We have been matching up people with properties since 2007; establishing great relationships, opinions and feedback that strive us to be different.We want to be the landlord that you can really trust.We care about our residents and we care about people. One way we show this is by reinvesting all of our profits into providing homes for those who cannot otherwise afford them and supporting initiatives, such as women?S refugees and homelessness projects.At Folio we do things a little different. Unlike other estate agents, we own every home we rent. This means no fees, no hidden costs and a dedicated Folio team to look after your needs. We put our residents first.Live DifferentLive BetterLive with Folio",-0.0683,51.488233,19/12/2018,19/12/2018,0.7 miles,,,,,,0.6 miles,,
28,49878541,"Chaucer Drive, London SE1",2 bed flat to rent,https://www.zoopla.co.uk/to-rent/details/49878541,"£1,387 pcm",,,Furnished,"Two bedroom one bathroom flat in Bermondsey, a great choice for a couple or two sharers!This property is available soon at a bargain rent and within easy commute of the city or West End. Early viewing recommended! Stock is going quickly!Our Ref: Rpl/iupload/CTL181024",-0.074016,51.489307,19/12/2018,19/12/2018,0.8 miles,,,,,,0.8 miles,,
29,49878540,"Chaucer Drive, London SE1",2 bed flat to rent,https://www.zoopla.co.uk/to-rent/details/49878540,"£1,499 pcm",,,Furnished,"Spacious and completely refurbished this twobedroom flat is a great choice for a couple or two sharers! Wooden floors throughout, brand new bathroom, kitchen in immaculate condition and very bright reception room with great City views!Our Ref: Rpl/iupload/CTL181023",-0.074016,51.489307,19/12/2018,19/12/2018,0.8 miles,,,,,,0.8 miles,,
30,49862221,"Rotherhithe New Road, London SE16",3 bed flat to rent,https://www.zoopla.co.uk/to-rent/details/49862221,"£1,668 pcm",,5th Jan 2019,Furnished,"The Champs are pleased to offer wonderfull cozy three bedroom one bathroom flat in Surrey Quays. The flat has to offer spacious fully furnished double rooms with plenty of natural sunlight. Seperate fully fitted kitchen with all the white goods in place. The living room has been converted into a third room which is handy for students or multiple occupancy. The flat is located within five minutes walk to Surrey Quays overground station that easily connects to Central London, City or Canary Wharf area. There are also plenty of local amenities around such as Surrey Quays Shopping Centre, Post Office, Banks, Barber Shops, Sport Complex and massive Southwark Park. Please call or send us an email to arrange a viewings",-0.048158,51.491713,19/12/2018,19/12/2018,,,,,,,,0.1 miles,
31,49856620,"Chaucer Drive, London SE1",1 bed flat to rent,https://www.zoopla.co.uk/to-rent/details/49856620,"£1,300 pcm",,15th Jan 2019,,One bedroom flat within a secure purpose built block which has been refurbished to a high standard. The perfect property for a single professional or coupleWithin walking distance to the array of bars and restaurants on Bermondsey Street. Conveniently located close to a Tesco superstore and great bus routes from the Old Kent Road.,-0.074016,51.489307,19/12/2018,19/12/2018,0.8 miles,,,,,,0.8 miles,,
32,49855631,"Cadet Drive, Bermondsey SE1",2 bed flat to rent,https://www.zoopla.co.uk/to-rent/details/49855631,"£1,452 pcm",,27th May 2017,Furnished,"City Docklands present to market this brand new refurbished two bedroom apartment located in Cadet Drive, SE1. The property is on the ground floor of this popular and secure entry purpose built block and comprises a open plan kitchen/reception, two double bedrooms and a luxury bathroom. Offered furnished.",-0.071027,51.489492,19/12/2018,19/12/2018,0.7 miles,,,,,,0.7 miles,,
33,49852892,"Mawbey Street, Bermondsey SE1",2 bed flat to rent,https://www.zoopla.co.uk/to-rent/details/49852892,"£1,452 pcm",,11th Jan 2019,Furnished,"A stylish two bedroom flat set on the second floor of a purpose block located just off Old Kent road, SE1.The property boasts a charming reception room opening onto a private balcony, a modern fully fitted kitchen, two bedrooms, a modern bathroom suite and a separate W/C.Further benefits include wood floors, double glazed windows, gas central heating and offers good access to a range of local amenities that old Kent Road has to offer.",-0.0714,51.48645,19/12/2018,19/12/2018,0.9 miles,,,,,,0.7 miles,,
34,49850232,"Great Dover Street, London SE1",2 bed flat to rent,https://www.zoopla.co.uk/to-rent/details/49850232,"£1,733 pcm",,6th Dec 2018,,"An ideally located this spacious two double bed-roomed apartment is situated in the heart of London Bridge. Boasting larger than average rooms, south facing balcony, separate kitchen, white walls, wooden floors and contemporary fittings throughout. This property is located in this very well kept purpose built block on the ground floor.For transport London Bridge Station (Northern line, Jubilee line and overground) is minutes away.The many delights of Borough Market and The South-bank are also minutes away.",-0.091334,51.49924,19/12/2018,19/12/2018,,0.2 miles,0.5 miles,,,,,,
35,49849962,"Barrow Stores Court, Decima Street, London SE1",1 bed flat to rent,https://www.zoopla.co.uk/to-rent/details/49849962,"£1,350 pcm",,2nd Dec 2018,Unfurnished,"Barrow Stores Court, Decima Street, Tower Bridge, SE1 4QQ.Come and view this immaculate and stylish lower ground floor studio flat to let In Tower Bridge SE1.The property I situated in an excellent location just between Tower Bridge and London Bridge.The apartment is situated on the lower ground floor in a modern building with video entry and elevators. The property offers the following features·Bright Open plan lounge/living area and kitchen·Modern and neutrally decorated throughout·Oak wood flooring·Small communal patio·Offered furnished·Fully fitted kitchenThe property is offered Inclusive of all utility bills except C tax and water.I terms of transport the property is in a superb location and is situated close to Borough Station (northern line) London",-0.08345,51.497591,19/12/2018,19/12/2018,,0.5 miles,,0.5 miles,,,,,
36,49845203,"Stansfeld House, London SE1",1 bed flat to rent,https://www.zoopla.co.uk/to-rent/details/49845203,"£1,300 pcm",,21st Jan 2019,Furnished,"Property Reference: 477136.1 Bed Flat, Stansfeld House, SE1.This 1 bedroom, 1 bathroom flat is available to move in from 21 January 2019.The rent is £1,300.00 per month (£300.00 per week).Property comes furnishedDeposit / Bond is £1,300.00Minimum tenancy is 1 MonthsMaximum number of tenants is 2More details available upon enquiry.Summary & Exclusions:- No DSS / Housing Benefit Applicants- Students welcome to enquire- No Pets, sorry- No Smokers- Family Friendly- Bills Included- Property has parking- No Garden Access- EPC Rating: D If calling, please quote reference: 477136 Fees:You will not be charged any admin fees.Referencing for tenants only costs £20 each, if requested by the landlord for this property.** Contact today to book a viewing and have the landlord show you round! **Request Details form responded to 24/7, with phone bookings available 9am-9pm, 7 days a week.OpenRent endeavours to make all property particulars as accurate and reliable as possible, however if you require any further clarification or information please contact us. When applying for a tenancy using the Rent Now process, you will be required to pay one month's rent and any deposit before moving in. This will be paid to OpenRent and released to the landlord once you have moved in. With OpenRent there are no administration fees to pay, although you may need to pay £20 per tenant to cover the cost of referencing if required by the landlord.",-0.072783,51.490546,19/12/2018,19/12/2018,0.7 miles,,,,,,0.8 miles,,
37,46376996,"Alscot Road, London SE1",2 bed flat to rent,https://www.zoopla.co.uk/to-rent/details/46376996,"£1,750 pcm",,30th Nov 2018,Furnished,"City Docklands present to market this two bedroom apartment located on Alscot Road, SE1 with beautiful views overlooking Bermondsey Spa Gardens.",-0.07383,51.494079,19/12/2018,19/12/2018,0.5 miles,,,0.9 miles,,,,,
38,49830995,"Sherwood Gardens, London SE16",2 bed flat to rent,https://www.zoopla.co.uk/to-rent/details/49830995,"£1,400 pcm",,29th Dec 2018,Furnished,"Presented to the market is this spacious two bedroom apartment, located in a private Development offering an abundance of natural light. Comprising a large lounge with Juliette balcony, a fully fitted kitchen, two good sized double bedrooms and a three piece family bathroom. The property is neutrally decorated throughout and offers excellent transport links including South Bermondsey Station.",-0.064429,51.486793,19/12/2018,19/12/2018,0.8 miles,,,,,,0.4 miles,,
39,49827059,"Goodwin Close, London SE16",2 bed flat to rent,https://www.zoopla.co.uk/to-rent/details/49827059,"£1,550 pcm",,1st Jan 2019,Unfurnished,"A nicely presented second floor two bedroomed purpose built flat situated within walking distance of Bermondsey Tube station. The property has a spacious lounge/diner, modern fitted kitchen and refitted shower room. The property is offered to let on an unfurnished basis and there is off street parking available.You enter the block through the communal hall which has stairs leading to second floor and the private entrance to the block. Inside the entrance hall gives access to the lounge/diner and, off it, to the kitchen which has a good range of modern fully fitted wall and base units with an integrated oven and hob, washing machine, dishwasher, microwave and fridge freezer.The main bedroom is carpeted and has an ensuite dressing room with a mirror fronted wardobe and a compact sink and vanity unit. The small bedroom is also carpeted and has a fitted wardrobe. There is a separate shower room with a fully enclosed shower cubicle, hand basin and low level WC.The flat is available long term from 1 January 2019Full DescriptionACCOMMODATIONCommunal Entrance: Hall and stairs leading to second floor andPrivate Entrance: Hardwood front doorEntrance Hall: L-shaped, entryphone handsetLounge/diner: 18’3 x 10’6 fitted spotlightsKitchen: 7’6 x 6’2 range of modern fully fitted wall and base units, stainless steel sink and drainer with mixer tap, extractor hood, integrated oven, integrated hob, washing machine, dishwasher, microwave, fridge freezer, part tiled wallsBedroom 1: 11’6 x 8’5 carpeted, open toEnsuite Dressing Room: Fitted wardrobe with mirror fronted sliding doors, inset compact sink and vanity unitBedroom 2: 9’3 x 5’9 carpeted,single bed, fitted wardrobe with glass folding door, chest of drawersShower room: 8’4 x 6’9 modern suite comprising fully enclosed shower cubicle, hand basin inset to vanity unit, low level WC suite, part tiled wallsOUTSIDECommunal groundsOff street parking",-0.07105,51.495077,19/12/2018,19/12/2018,0.4 miles,,,,,,0.8 miles,,
40,49823019,"Oxley Close, London SE1",1 bed terraced house to rent,https://www.zoopla.co.uk/to-rent/details/49823019,"£1,250 pcm",,6th Jan 2019,Part furnished,"RE/MAX Vision are pleased to present this modern house to rent close to central London.Property comprises a open plan kitchen, open plan living room, double bedroom, 3 piece bathroom, private rear garden and parking.This property is conveniently located just a short walk from the main road where there are numerous 24 hour bus links into the West End. Nearest station is London Bridge & Elephant & Castle.Local amenities including Tesco, asda, Post Office, 24 hour gym, 24 hour off licences and numerous pan asian restaurants.Property will be available to move in from 6th January 2019.Updated photos will be uploaded 1st JanuaryPlease get in touch for more details.",-0.071673,51.489188,19/12/2018,19/12/2018,0.7 miles,,,,,,0.7 miles,,
41,45272911,"Elephant Lane, London SE16",1 bed flat to rent,https://www.zoopla.co.uk/to-rent/details/45272911,"£1,365 pcm",,14th Jan 2019,Furnished,"Key features:1 BedroomFurnishedRiver ViewOver 550 sqftFull description:This large 1 Bedroom is situated in the quite part of Rotherhithe offering, very large reception room, one bathroom, Fully equipped kitchen, available fully furnished, Close to Bermondsey Jubilee Line - 5mis to London Bridge Station. Water & Electric Bills Included.This large 1 Bedroom is situated in the quite part of Rotherhithe offering, very large reception room, one bathroom, Fully equipped kitchen, available fully furnished, Close to Bermondsey Jubilee Line - 5mis to London Bridge Station. Water & Electric Bills Included.Tenancy Administration Fee £275.00Additional Tenant - £45 per personReferencing Fees (applicant or guarantor) £95.00Deposit Registration Fee £30.00Inventory/Check In Fee - Studio Apartment - £230.00All above Include VAT",-0.055832,51.500608,19/12/2018,19/12/2018,,,,,,0.2 miles,,,
42,49795020,"Grange Road, London SE1",1 bed flat to rent,https://www.zoopla.co.uk/to-rent/details/49795020,"£1,600 pcm",,27th Nov 2018,Unfurnished,"*rent fee free with L&Q*Twist House is a stunning new development a short walk from the ever popular Bermondsey Street with its array of bars, boutiques, galleries and restaurants. This is a one bedroom, 1st floor, newly built apartment available to rent in central SE1 location.The property boasts one double bedroom with fitted wardrobe, spacious open plan living with fully integrated kitchen, modern fitted bathroom with heated towel rail and own private balcony.This property is offered unfurnished and available immediately.Contact us to arrange your appointment today on .Please note: Images shown are of the show home - specification will be the same but layouts may differ",-0.07932,51.495743,19/12/2018,19/12/2018,0.7 miles,,,0.7 miles,,,,,
43,49789727,"Cherry Garden Street, London SE16",1 bed flat to rent,https://www.zoopla.co.uk/to-rent/details/49789727,"£1,350 pcm",,22nd Jan 2019,Furnished,"A one-bedroom apartment situated on the first floor. This generously proportioned flat is presented in good condition throughout and comprises of a spacious lounge, double bedroom, fitted kitchen and a bathroom. The property further benefits from double glazing, gas central heating and allocated parking space. Cherry Garden Street is located a short walk from the River Thames and provides fantastic transport links.Agency Fees ApplyAdministration fee £200 per propertyReference fee £60 per personCheck out fee £100",-0.061102,51.499328,19/12/2018,19/12/2018,0.1 miles,,,,,0.3 miles,,,
44,45584407,"294 St James Road, London SE1",1 bed flat to rent,https://www.zoopla.co.uk/to-rent/details/45584407,"£1,560 pcm",,28th Jan 2019,Unfurnished,"This very large 1 bedroom warehouse conversation is available from Mid January. Finished to the highest of standards with exposed brick work, communal gardens and plenty of natural light. A stones through away from Bermondsey Station with direct links into the city. Contact Cubix today!Open 7 days a week and happy to accommodate.",-0.066102,51.48638,19/12/2018,19/12/2018,0.8 miles,,,,,,0.5 miles,,
45,49738607,"Bridgeview Court, 19 Grange Road, London SE1",1 bed flat to rent,https://www.zoopla.co.uk/to-rent/details/49738607,"£1,322 pcm",,20th Nov 2018,Furnished,"A well maintained one bedroom, one bathroom apartment in Bridgeview Court, boasting a fantastic City location close to London Bridge and the City.Situated on the fifth floor, the property comprises a spacious lounge with a Juliette balcony, a separate kitchen with integrated appliances and a double sized bedroom. The flat is offered furnished as shown in the pictures.Bridgeview Court is a secure, gated development with 24 hour surveillance for added safety for its residents. It is available to view immediately and ready to move in to.",-0.080443,51.496121,19/12/2018,19/12/2018,,0.7 miles,,0.7 miles,,,,,
46,49726383,"Grange Road, London SE1",2 bed flat to rent,https://www.zoopla.co.uk/to-rent/details/49726383,"£1,499 pcm",,,Furnished,Atkinson Mcleod is pleased to bring to the market this stunning split level apartment on Grange Road in Bermondsey. The apartment has just had a re-paint and is available immediately. The apartment offers two good size double bedrooms a very nice bathroom and huge open plan living room. Call our Lettings team today to book in your viewing.Our Ref: Rpl/iupload/CTL180981,-0.076079,51.494377,19/12/2018,19/12/2018,0.6 miles,,,0.8 miles,,,,,
47,49723708,"Chaucer Drive, London SE1",2 bed flat to rent,https://www.zoopla.co.uk/to-rent/details/49723708,"£1,517 pcm",,,Furnished,"Two bedroom one bathroom flat in Bermondsey, a great choice for a couple or two sharers!This property is available soon at a bargain rent and within easy commute of the city or West End. Early viewing recommended! Stock is going quickly!Our Ref: Rpl/iupload/CTL180980",-0.074016,51.489307,19/12/2018,19/12/2018,0.8 miles,,,,,,0.8 miles,,
48,49704944,"Law Street, London SE1",1 bed flat to rent,https://www.zoopla.co.uk/to-rent/details/49704944,"£1,348 pcm",,,Furnished,"A great value for money 1 bedroom apartment with Separate living room and kitchen in London Bridge SE1.The apartment offers a comfortable living space and benefits from being under 10 minutes walk distance to Kings College guys Campus, Borough & London Bridge underground stations. Available 23rd December 2018",-0.087139,51.497211,19/12/2018,19/12/2018,,0.4 miles,,0.6 miles,,,,,
49,45041592,"Burbage Close, London SE1",2 bed flat to rent,https://www.zoopla.co.uk/to-rent/details/45041592,"£1,668 pcm",,6th Dec 2018,Part furnished,"This stylish and redecorated two bedroomed apartment boasts size, quality and location. Situated on the top (third) floor of this very well looked after ex-local authority building.Boasting a larger than average stylish kitchen reception room, two generous sized double bedrooms, contemporary bathroom with walk in shower and charming private balcony.Transport links are plentiful with Borough Tube Station (Northern Line) and London Bridge Tube and Train Station (Jubilee Line, Northern Line and London Overground) being in close proximity. The delights of Borough market and Bermondsey Street are within walking distance.",-0.088418,51.495235,19/12/2018,19/12/2018,,0.5 miles,0.5 miles,,,,,,
50,49696829,"Grange Road, Bermondsey, London SE1",2 bed property to rent,https://www.zoopla.co.uk/to-rent/details/49696829,"£1,603 pcm",premium-listing,,,Contemporary and spacious two bedroom apartment in SE1. Perfect commute to London Bridge and walking distance to the city.Perfect flat with great interior and high spec finish make this a great place for two professionals looking for a well-priced property only a short commute away from Central London.Our Ref: Rpl/iupload/CTL161465,-0.076079,51.494377,19/12/2018,19/12/2018,0.6 miles,,,0.8 miles,,,,,
51,49689760,"Manor Estate, London SE16",3 bed flat to rent,https://www.zoopla.co.uk/to-rent/details/49689760,"£1,647 pcm",,2nd Dec 2018,Part furnished,"Oppida Estates are delighted to present to the market this light and spacious 3 bedroom flat arranged over two floors. The property comprises 2 double bedrooms, study, large and airy reception room, separate kitchen and bathroom. Benefits include double glazed windows and wood flooring throughout. Bermondsey Underground and South Bermondsey Rail stations are within short walking distance as well as local amenities in The Blue and Surrey Quays shopping centre. The property would be suitable for two sharers or a family.",-0.063164,51.491134,19/12/2018,19/12/2018,0.5 miles,,,,,,0.4 miles,,
52,34180655,"Jamaica Road, London SE16",1 bed flat to rent,https://www.zoopla.co.uk/to-rent/details/34180655,"£1,300 pcm",,19th Dec 2018,Furnished,"Oppida Estates are pleased to offer for rent this spacious one double bedroom apartment located on the 4th floor of this popular development in Bermondsey. The apartment comprises of spacious living room with access to a private balcony, separate fully fitted kitchen and lots of storage space. The property benefits from laminate flooring, double glazed windows and gas central heating. Bermondsey tube station is located within a 5 minute walk from the property.",-0.05932,51.498894,19/12/2018,19/12/2018,0.2 miles,,,,,0.3 miles,,,
53,43759054,"Spa Road, London SE16",1 bed flat to rent,https://www.zoopla.co.uk/to-rent/details/43759054,"£1,450 pcm",,20th Nov 2018,Part furnished,"A one double bedroom, one bathroom apartment in Bermondsey area. The property is a modern apartment situated within a converted Victorian building, all the property has been converted into a modern and creative space.Has a fully fitted modern kitchen open plan to the reception and wooden floors throughout, full tiled bathroom with shower and a big terrace/balcony.Convenience:- Close to Tower Bridge and London Bridge!- Just off Bermondsey Tube station (5 minutes walking), London Bridge tube (10 minutes walking) & Tower Bridge (5 minutes walking)- Friendly community spirit with the local clubs (yoga, book club, music and theatre)- Convenient close shops (Sainsbury´s, Tesco and The Cooperative)- Close Gym- 3 minutes walking from the trendy and new Maltby Street Market- 10 minutes walking from Borough MarketViewings highly recommended.Price: £1,450 per calendar month / £335 per week",-0.072784,51.495654,19/12/2018,19/12/2018,0.4 miles,,,0.8 miles,,,,,
54,49656044,"Rotherhithe New Road, Surrey Quays, London SE16",1 bed flat to rent,https://www.zoopla.co.uk/to-rent/details/49656044,"£1,153 pcm",,12th Nov 2018,Unfurnished,"**landlords Christmas sale price reduced **We are pleased to offer this spacious, one bedroom apartment. The property features a separate kitchen double bedroom and spacious lounge. Offered to the market as unfurnished and available now.Situated a short walk from both South Bermondsey and Surrey Quays stations.",-0.054451,51.490405,19/12/2018,19/12/2018,,,,,,,0.1 miles,0.3 miles,
55,49639747,"Maltby Street, London SE1",1 bed flat to rent,https://www.zoopla.co.uk/to-rent/details/49639747,"£1,733 pcm",,12th Jan 2020,Furnished,"A large and modern one double bedroom new build apartment located in the popular Bermondsey Central development. The property benefits from a very good specification throughout and consists of an extremely large open plan reception with fully integrated kitchen, a modern and contemporary bathroom suite, a good size double bedroom with built in wardrobes and a south west facing balcony accessible from both bedroom and reception. Available from mid January. Viewings are highly recommended.",-0.075678,51.49911,19/12/2018,19/12/2018,0.5 miles,,,0.6 miles,,,,,
56,49637904,"Law Street, London SE1",2 bed flat to rent,https://www.zoopla.co.uk/to-rent/details/49637904,"£1,348 pcm",,,Furnished,"A great value for money 2 double bedroom apartment with no living room in London Bridge SE1. The property features a separate kitchen and living room which the landlord is happy to be used as the second bedroom.The apartment offers a comfortable living space and benefits from being under 10 minutes walk distance to Kings College guys Campus, Borough & London Bridge underground stations. Available 23rd December 2018",-0.087139,51.497211,19/12/2018,19/12/2018,,0.4 miles,,0.6 miles,,,,,
57,49637098,"Grange Road, London SE1",1 bed flat to rent,https://www.zoopla.co.uk/to-rent/details/49637098,"£1,322 pcm",,9th Nov 2018,Furnished,"A one double apartment located on the fifth floor of this popular gated development just moments from Bermondsey Street. The property comprises of one double bedroom, reception, separate kitchen and main bathroom. Bridgeview Court benefits from a daytime porter, secure entry system and lift. London Bridge station and The City are all within easy walking distance. Presented furnished and available now.",-0.080443,51.496121,19/12/2018,19/12/2018,,0.7 miles,,0.7 miles,,,,,
58,49623938,"Balaclava Road, London SE1",2 bed flat to rent,https://www.zoopla.co.uk/to-rent/details/49623938,"£1,452 pcm",,,Unfurnished,"Please quote reference 36046 when enquiring about this propertyThe flat comprises two spacious double bedrooms, a living/reception room, first floor family bathroom and separate kitchen. Currently unfurnished.The flat has good bus and tube links. Bermondsey Underground Station (Zone 2) is a 15 minute walk.Southernwood Retail park and Superstore is a 6 minute walk away.Canary Wharf - 21 minsBank - 27 minsBond Street - 27 minsEPC - C",-0.072164,51.490869,19/12/2018,19/12/2018,0.6 miles,,,,,,0.8 miles,,
